No,;Time;Source;Destination;Protocol;Length;Info;;;Time 1;Time 2;Delay;;Delay 1;Delay 2;Jitter
19;3.792.393;792393;2606:50c0:8001::154;TCP;75;51469  >  443 [ACK] Seq=1 Ack=1 Win=508 Len=1 [TCP segment of a reassembled PDU];;;3,792393;3,819893;0,0275;;-1,130905;1,158405;2,28931
20;3.819.893;2606:50c0:8001::154;2001:448a:10a9:21c4:dc8a:ca05:995f:f94;TCP;86;443  >  51469 [ACK] Seq=1 Ack=2 Win=338 Len=0 SLE=1 SRE=2;;;3,819893;4,978298;1,158405;;1,14224;0,016165;-1,126075
22;4.978.298;2001:448a:10a9:21c4:dc8a:ca05:995f:f94;2001:4488:f931::7662:5f5a;TLSv1.2;901;Application Data;;;4,978298;4,994463;0,016165;;0,016165;0;-0,016165
23;4.994.463;2001:4488:f931::7662:5f5a;2001:448a:10a9:21c4:dc8a:ca05:995f:f94;TLSv1.2;662;Application Data;;;4,994463;4,994463;0;;0;0;0
24;4.994.463;2001:4488:f931::7662:5f5a;2001:448a:10a9:21c4:dc8a:ca05:995f:f94;TCP;1486;443  >  51467 [ACK] Seq=589 Ack=828 Win=377 Len=1412 [TCP segment of a reassembled PDU];;;4,994463;4,994463;0;;0;0;0
25;4.994.463;2001:4488:f931::7662:5f5a;2001:448a:10a9:21c4:dc8a:ca05:995f:f94;TCP;1486;443  >  51467 [ACK] Seq=2001 Ack=828 Win=377 Len=1412 [TCP segment of a reassembled PDU];;;4,994463;4,994463;0;;0;0;0
26;4.994.463;2001:4488:f931::7662:5f5a;2001:448a:10a9:21c4:dc8a:ca05:995f:f94;TCP;1486;443  >  51467 [ACK] Seq=3413 Ack=828 Win=377 Len=1412 [TCP segment of a reassembled PDU];;;4,994463;4,994463;0;;-8,4E-05;8,4E-05;0,000168
27;4.994.463;2001:4488:f931::7662:5f5a;2001:448a:10a9:21c4:dc8a:ca05:995f:f94;TCP;1486;443  >  51467 [ACK] Seq=4825 Ack=828 Win=377 Len=1412 [TCP segment of a reassembled PDU];;;4,994463;4,994547;8,4E-05;;-0,000104;0,000188;0,000292
28;4.994.547;2001:448a:10a9:21c4:dc8a:ca05:995f:f94;2001:4488:f931::7662:5f5a;TCP;74;51467  >  443 [ACK] Seq=828 Ack=6237 Win=3088 Len=0;;;4,994547;4,994735;0,000188;;0,000188;0;-0,000188
29;4.994.735;2001:4488:f931::7662:5f5a;2001:448a:10a9:21c4:dc8a:ca05:995f:f94;TCP;1486;443  >  51467 [ACK] Seq=6237 Ack=828 Win=377 Len=1412 [TCP segment of a reassembled PDU];;;4,994735;4,994735;0;;0;0;0
30;4.994.735;2001:4488:f931::7662:5f5a;2001:448a:10a9:21c4:dc8a:ca05:995f:f94;TCP;1486;443  >  51467 [ACK] Seq=7649 Ack=828 Win=377 Len=1412 [TCP segment of a reassembled PDU];;;4,994735;4,994735;0;;0;0;0
31;4.994.735;2001:4488:f931::7662:5f5a;2001:448a:10a9:21c4:dc8a:ca05:995f:f94;TCP;1486;443  >  51467 [ACK] Seq=9061 Ack=828 Win=377 Len=1412 [TCP segment of a reassembled PDU];;;4,994735;4,994735;0;;-3,9E-05;3,9E-05;7,8E-05
32;4.994.735;2001:4488:f931::7662:5f5a;2001:448a:10a9:21c4:dc8a:ca05:995f:f94;TCP;1486;443  >  51467 [ACK] Seq=10473 Ack=828 Win=377 Len=1412 [TCP segment of a reassembled PDU];;;4,994735;4,994774;3,9E-05;;-0,000154;0,000193;0,000347
33;4.994.774;2001:448a:10a9:21c4:dc8a:ca05:995f:f94;2001:4488:f931::7662:5f5a;TCP;74;51467  >  443 [ACK] Seq=828 Ack=11885 Win=3088 Len=0;;;4,994774;4,994967;0,000193;;0,000193;0;-0,000193
34;4.994.967;2001:4488:f931::7662:5f5a;2001:448a:10a9:21c4:dc8a:ca05:995f:f94;TCP;1486;443  >  51467 [ACK] Seq=11885 Ack=828 Win=377 Len=1412 [TCP segment of a reassembled PDU];;;4,994967;4,994967;0;;-3,3E-05;3,3E-05;6,6E-05
35;4.994.967;2001:4488:f931::7662:5f5a;2001:448a:10a9:21c4:dc8a:ca05:995f:f94;TCP;1486;443  >  51467 [ACK] Seq=13297 Ack=828 Win=377 Len=1412 [TCP segment of a reassembled PDU];;;4,994967;4,995;3,3E-05;;-0,000655;0,000688;0,001343
36;4.995.000;2001:448a:10a9:21c4:dc8a:ca05:995f:f94;2001:4488:f931::7662:5f5a;TCP;74;51467  >  443 [ACK] Seq=828 Ack=14709 Win=3088 Len=0;;;4,995;4,995688;0,000688;;0,000688;0;-0,000688
37;4.995.688;2001:4488:f931::7662:5f5a;2001:448a:10a9:21c4:dc8a:ca05:995f:f94;TCP;1486;443  >  51467 [ACK] Seq=14709 Ack=828 Win=377 Len=1412 [TCP segment of a reassembled PDU];;;4,995688;4,995688;0;;0;0;0
38;4.995.688;2001:4488:f931::7662:5f5a;2001:448a:10a9:21c4:dc8a:ca05:995f:f94;TLSv1.2;955;Application Data;;;4,995688;4,995688;0;;0;0;0
39;4.995.688;2001:4488:f931::7662:5f5a;2001:448a:10a9:21c4:dc8a:ca05:995f:f94;TCP;1486;443  >  51467 [ACK] Seq=17002 Ack=828 Win=377 Len=1412 [TCP segment of a reassembled PDU];;;4,995688;4,995688;0;;-4,4E-05;4,4E-05;8,8E-05
40;4.995.688;2001:4488:f931::7662:5f5a;2001:448a:10a9:21c4:dc8a:ca05:995f:f94;TCP;1486;443  >  51467 [ACK] Seq=18414 Ack=828 Win=377 Len=1412 [TCP segment of a reassembled PDU];;;4,995688;4,995732;4,4E-05;;-0,000175;0,000219;0,000394
41;4.995.732;2001:448a:10a9:21c4:dc8a:ca05:995f:f94;2001:4488:f931::7662:5f5a;TCP;74;51467  >  443 [ACK] Seq=828 Ack=19826 Win=3088 Len=0;;;4,995732;4,995951;0,000219;;0,000219;0;-0,000219
42;4.995.951;2001:4488:f931::7662:5f5a;2001:448a:10a9:21c4:dc8a:ca05:995f:f94;TCP;1486;443  >  51467 [ACK] Seq=19826 Ack=828 Win=377 Len=1412 [TCP segment of a reassembled PDU];;;4,995951;4,995951;0;;0;0;0
43;4.995.951;2001:4488:f931::7662:5f5a;2001:448a:10a9:21c4:dc8a:ca05:995f:f94;TCP;1486;443  >  51467 [ACK] Seq=21238 Ack=828 Win=377 Len=1412 [TCP segment of a reassembled PDU];;;4,995951;4,995951;0;;0;0;0
44;4.995.951;2001:4488:f931::7662:5f5a;2001:448a:10a9:21c4:dc8a:ca05:995f:f94;TCP;1486;443  >  51467 [ACK] Seq=22650 Ack=828 Win=377 Len=1412 [TCP segment of a reassembled PDU];;;4,995951;4,995951;0;;0;0;0
45;4.995.951;2001:4488:f931::7662:5f5a;2001:448a:10a9:21c4:dc8a:ca05:995f:f94;TCP;1486;443  >  51467 [ACK] Seq=24062 Ack=828 Win=377 Len=1412 [TCP segment of a reassembled PDU];;;4,995951;4,995951;0;;0;0;0
46;4.995.951;2001:4488:f931::7662:5f5a;2001:448a:10a9:21c4:dc8a:ca05:995f:f94;TCP;1486;443  >  51467 [ACK] Seq=25474 Ack=828 Win=377 Len=1412 [TCP segment of a reassembled PDU];;;4,995951;4,995951;0;;-3,1E-05;3,1E-05;6,2E-05
47;4.995.951;2001:4488:f931::7662:5f5a;2001:448a:10a9:21c4:dc8a:ca05:995f:f94;TCP;1486;443  >  51467 [ACK] Seq=26886 Ack=828 Win=377 Len=1412 [TCP segment of a reassembled PDU];;;4,995951;4,995982;3,1E-05;;-9,8E-05;0,000129;0,000227
48;4.995.982;2001:448a:10a9:21c4:dc8a:ca05:995f:f94;2001:4488:f931::7662:5f5a;TCP;74;51467  >  443 [ACK] Seq=828 Ack=28298 Win=3088 Len=0;;;4,995982;4,996111;0,000129;;0,000129;0;-0,000129
49;4.996.111;2001:4488:f931::7662:5f5a;2001:448a:10a9:21c4:dc8a:ca05:995f:f94;TCP;1486;443  >  51467 [ACK] Seq=28298 Ack=828 Win=377 Len=1412 [TCP segment of a reassembled PDU];;;4,996111;4,996111;0;;-1,8E-05;1,8E-05;3,6E-05
50;4.996.111;2001:4488:f931::7662:5f5a;2001:448a:10a9:21c4:dc8a:ca05:995f:f94;TCP;1486;443  >  51467 [ACK] Seq=29710 Ack=828 Win=377 Len=1412 [TCP segment of a reassembled PDU];;;4,996111;4,996129;1,8E-05;;-0,000321;0,000339;0,00066
51;4.996.129;2001:448a:10a9:21c4:dc8a:ca05:995f:f94;2001:4488:f931::7662:5f5a;TCP;74;51467  >  443 [ACK] Seq=828 Ack=31122 Win=3088 Len=0;;;4,996129;4,996468;0,000339;;0,000339;0;-0,000339
52;4.996.468;2001:4488:f931::7662:5f5a;2001:448a:10a9:21c4:dc8a:ca05:995f:f94;TCP;1486;443  >  51467 [ACK] Seq=31122 Ack=828 Win=377 Len=1412 [TCP segment of a reassembled PDU];;;4,996468;4,996468;0;;-2E-05;2E-05;4E-05
53;4.996.468;2001:4488:f931::7662:5f5a;2001:448a:10a9:21c4:dc8a:ca05:995f:f94;TLSv1.2;1486;Application Data [TCP segment of a reassembled PDU];;;4,996468;4,996488;2E-05;;-0,000745;0,000765;0,00151
54;4.996.488;2001:448a:10a9:21c4:dc8a:ca05:995f:f94;2001:4488:f931::7662:5f5a;TCP;74;51467  >  443 [ACK] Seq=828 Ack=33946 Win=3088 Len=0;;;4,996488;4,997253;0,000765;;0,000765;0;-0,000765
55;4.997.253;2001:4488:f931::7662:5f5a;2001:448a:10a9:21c4:dc8a:ca05:995f:f94;TCP;1486;443  >  51467 [ACK] Seq=33946 Ack=828 Win=377 Len=1412 [TCP segment of a reassembled PDU];;;4,997253;4,997253;0;;-1,9E-05;1,9E-05;3,8E-05
56;4.997.253;2001:4488:f931::7662:5f5a;2001:448a:10a9:21c4:dc8a:ca05:995f:f94;TCP;1486;443  >  51467 [ACK] Seq=35358 Ack=828 Win=377 Len=1412 [TCP segment of a reassembled PDU];;;4,997253;4,997272;1,9E-05;;-0,000419;0,000438;0,000857
57;4.997.272;2001:448a:10a9:21c4:dc8a:ca05:995f:f94;2001:4488:f931::7662:5f5a;TCP;74;51467  >  443 [ACK] Seq=828 Ack=36770 Win=3088 Len=0;;;4,997272;4,99771;0,000438;;0,000438;0;-0,000438
58;4.997.710;2001:4488:f931::7662:5f5a;2001:448a:10a9:21c4:dc8a:ca05:995f:f94;TCP;1486;443  >  51467 [ACK] Seq=36770 Ack=828 Win=377 Len=1412 [TCP segment of a reassembled PDU];;;4,99771;4,99771;0;;0;0;0
59;4.997.710;2001:4488:f931::7662:5f5a;2001:448a:10a9:21c4:dc8a:ca05:995f:f94;TCP;1486;443  >  51467 [ACK] Seq=38182 Ack=828 Win=377 Len=1412 [TCP segment of a reassembled PDU];;;4,99771;4,99771;0;;0;0;0
60;4.997.710;2001:4488:f931::7662:5f5a;2001:448a:10a9:21c4:dc8a:ca05:995f:f94;TLSv1.2;564;Application Data;;;4,99771;4,99771;0;;0;0;0
61;4.997.710;2001:4488:f931::7662:5f5a;2001:448a:10a9:21c4:dc8a:ca05:995f:f94;TCP;1486;443  >  51467 [ACK] Seq=40084 Ack=828 Win=377 Len=1412 [TCP segment of a reassembled PDU];;;4,99771;4,99771;0;;-2,2E-05;2,2E-05;4,4E-05
62;4.997.710;2001:4488:f931::7662:5f5a;2001:448a:10a9:21c4:dc8a:ca05:995f:f94;TCP;1486;443  >  51467 [ACK] Seq=41496 Ack=828 Win=377 Len=1412 [TCP segment of a reassembled PDU];;;4,99771;4,997732;2,2E-05;;-0,000177;0,000199;0,000376
63;4.997.732;2001:448a:10a9:21c4:dc8a:ca05:995f:f94;2001:4488:f931::7662:5f5a;TCP;74;51467  >  443 [ACK] Seq=828 Ack=42908 Win=3088 Len=0;;;4,997732;4,997931;0,000199;;0,000199;0;-0,000199
64;4.997.931;2001:4488:f931::7662:5f5a;2001:448a:10a9:21c4:dc8a:ca05:995f:f94;TCP;1486;443  >  51467 [ACK] Seq=42908 Ack=828 Win=377 Len=1412 [TCP segment of a reassembled PDU];;;4,997931;4,997931;0;;-1,9E-05;1,9E-05;3,8E-05
65;4.997.931;2001:4488:f931::7662:5f5a;2001:448a:10a9:21c4:dc8a:ca05:995f:f94;TCP;1486;443  >  51467 [ACK] Seq=44320 Ack=828 Win=377 Len=1412 [TCP segment of a reassembled PDU];;;4,997931;4,99795;1,9E-05;;-0,000326;0,000345;0,000671
66;4.997.950;2001:448a:10a9:21c4:dc8a:ca05:995f:f94;2001:4488:f931::7662:5f5a;TCP;74;51467  >  443 [ACK] Seq=828 Ack=45732 Win=3088 Len=0;;;4,99795;4,998295;0,000345;;0,000345;0;-0,000345
67;4.998.295;2001:4488:f931::7662:5f5a;2001:448a:10a9:21c4:dc8a:ca05:995f:f94;TCP;1486;443  >  51467 [ACK] Seq=45732 Ack=828 Win=377 Len=1412 [TCP segment of a reassembled PDU];;;4,998295;4,998295;0;;0;0;0
68;4.998.295;2001:4488:f931::7662:5f5a;2001:448a:10a9:21c4:dc8a:ca05:995f:f94;TCP;1486;443  >  51467 [ACK] Seq=47144 Ack=828 Win=377 Len=1412 [TCP segment of a reassembled PDU];;;4,998295;4,998295;0;;0;0;0
69;4.998.295;2001:4488:f931::7662:5f5a;2001:448a:10a9:21c4:dc8a:ca05:995f:f94;TCP;1486;443  >  51467 [ACK] Seq=48556 Ack=828 Win=377 Len=1412 [TCP segment of a reassembled PDU];;;4,998295;4,998295;0;;-2,2E-05;2,2E-05;4,4E-05
70;4.998.295;2001:4488:f931::7662:5f5a;2001:448a:10a9:21c4:dc8a:ca05:995f:f94;TCP;1486;443  >  51467 [ACK] Seq=49968 Ack=828 Win=377 Len=1412 [TCP segment of a reassembled PDU];;;4,998295;4,998317;2,2E-05;;-0,000304;0,000326;0,00063
71;4.998.317;2001:448a:10a9:21c4:dc8a:ca05:995f:f94;2001:4488:f931::7662:5f5a;TCP;74;51467  >  443 [ACK] Seq=828 Ack=51380 Win=3088 Len=0;;;4,998317;4,998643;0,000326;;0,000326;0;-0,000326
72;4.998.643;2001:4488:f931::7662:5f5a;2001:448a:10a9:21c4:dc8a:ca05:995f:f94;TCP;1486;443  >  51467 [ACK] Seq=51380 Ack=828 Win=377 Len=1412 [TCP segment of a reassembled PDU];;;4,998643;4,998643;0;;0;0;0
73;4.998.643;2001:4488:f931::7662:5f5a;2001:448a:10a9:21c4:dc8a:ca05:995f:f94;TCP;1486;443  >  51467 [ACK] Seq=52792 Ack=828 Win=377 Len=1412 [TCP segment of a reassembled PDU];;;4,998643;4,998643;0;;0;0;0
74;4.998.643;2001:4488:f931::7662:5f5a;2001:448a:10a9:21c4:dc8a:ca05:995f:f94;TCP;1486;443  >  51467 [ACK] Seq=54204 Ack=828 Win=377 Len=1412 [TCP segment of a reassembled PDU];;;4,998643;4,998643;0;;-2,1E-05;2,1E-05;4,2E-05
75;4.998.643;2001:4488:f931::7662:5f5a;2001:448a:10a9:21c4:dc8a:ca05:995f:f94;TLSv1.2;1486;Application Data [TCP segment of a reassembled PDU];;;4,998643;4,998664;2,1E-05;;-0,000257;0,000278;0,000535
76;4.998.664;2001:448a:10a9:21c4:dc8a:ca05:995f:f94;2001:4488:f931::7662:5f5a;TCP;74;51467  >  443 [ACK] Seq=828 Ack=57028 Win=3088 Len=0;;;4,998664;4,998942;0,000278;;0,000278;0;-0,000278
77;4.998.942;2001:4488:f931::7662:5f5a;2001:448a:10a9:21c4:dc8a:ca05:995f:f94;TCP;1486;443  >  51467 [ACK] Seq=57028 Ack=828 Win=377 Len=1412 [TCP segment of a reassembled PDU];;;4,998942;4,998942;0;;-2E-05;2E-05;4E-05
78;4.998.942;2001:4488:f931::7662:5f5a;2001:448a:10a9:21c4:dc8a:ca05:995f:f94;TCP;1486;443  >  51467 [ACK] Seq=58440 Ack=828 Win=377 Len=1412 [TCP segment of a reassembled PDU];;;4,998942;4,998962;2E-05;;-0,000251;0,000271;0,000522
79;4.998.962;2001:448a:10a9:21c4:dc8a:ca05:995f:f94;2001:4488:f931::7662:5f5a;TCP;74;51467  >  443 [ACK] Seq=828 Ack=59852 Win=3088 Len=0;;;4,998962;4,999233;0,000271;;0,000271;0;-0,000271
80;4.999.233;2001:4488:f931::7662:5f5a;2001:448a:10a9:21c4:dc8a:ca05:995f:f94;TCP;1486;443  >  51467 [ACK] Seq=59852 Ack=828 Win=377 Len=1412 [TCP segment of a reassembled PDU];;;4,999233;4,999233;0;;-1,6E-05;1,6E-05;3,2E-05
81;4.999.233;2001:4488:f931::7662:5f5a;2001:448a:10a9:21c4:dc8a:ca05:995f:f94;TCP;1486;443  >  51467 [ACK] Seq=61264 Ack=828 Win=377 Len=1412 [TCP segment of a reassembled PDU];;;4,999233;4,999249;1,6E-05;;-0,000582;0,000598;0,00118
82;4.999.249;2001:448a:10a9:21c4:dc8a:ca05:995f:f94;2001:4488:f931::7662:5f5a;TCP;74;51467  >  443 [ACK] Seq=828 Ack=62676 Win=3088 Len=0;;;4,999249;4,999847;0,000598;;0,000598;0;-0,000598
83;4.999.847;2001:4488:f931::7662:5f5a;2001:448a:10a9:21c4:dc8a:ca05:995f:f94;TCP;1486;443  >  51467 [ACK] Seq=62676 Ack=828 Win=377 Len=1412 [TCP segment of a reassembled PDU];;;4,999847;4,999847;0;;-1,6E-05;1,6E-05;3,2E-05
84;4.999.847;2001:4488:f931::7662:5f5a;2001:448a:10a9:21c4:dc8a:ca05:995f:f94;TCP;1486;443  >  51467 [ACK] Seq=64088 Ack=828 Win=377 Len=1412 [TCP segment of a reassembled PDU];;;4,999847;4,999863;1,6E-05;;-1,6E-05;3,2E-05;4,8E-05
85;4.999.863;2001:448a:10a9:21c4:dc8a:ca05:995f:f94;2001:4488:f931::7662:5f5a;TCP;74;51467  >  443 [ACK] Seq=828 Ack=65500 Win=3088 Len=0;;;4,999863;4,999895;3,2E-05;;3,2E-05;0;-3,2E-05
86;4.999.895;2001:4488:f931::7662:5f5a;2001:448a:10a9:21c4:dc8a:ca05:995f:f94;TCP;1486;443  >  51467 [ACK] Seq=65500 Ack=828 Win=377 Len=1412 [TCP segment of a reassembled PDU];;;4,999895;4,999895;0;;0;0;0
87;4.999.895;2001:4488:f931::7662:5f5a;2001:448a:10a9:21c4:dc8a:ca05:995f:f94;TCP;1486;443  >  51467 [ACK] Seq=66912 Ack=828 Win=377 Len=1412 [TCP segment of a reassembled PDU];;;4,999895;4,999895;0;;0;0;0
88;4.999.895;2001:4488:f931::7662:5f5a;2001:448a:10a9:21c4:dc8a:ca05:995f:f94;TCP;1486;443  >  51467 [ACK] Seq=68324 Ack=828 Win=377 Len=1412 [TCP segment of a reassembled PDU];;;4,999895;4,999895;0;;-1,6E-05;1,6E-05;3,2E-05
89;4.999.895;2001:4488:f931::7662:5f5a;2001:448a:10a9:21c4:dc8a:ca05:995f:f94;TCP;1486;443  >  51467 [ACK] Seq=69736 Ack=828 Win=377 Len=1412 [TCP segment of a reassembled PDU];;;4,999895;4,999911;1,6E-05;;-0,000428;0,000444;0,000872
90;4.999.911;2001:448a:10a9:21c4:dc8a:ca05:995f:f94;2001:4488:f931::7662:5f5a;TCP;74;51467  >  443 [ACK] Seq=828 Ack=71148 Win=3088 Len=0;;;4,999911;5,000355;0,000444;;0,000444;0;-0,000444
91;5.000.355;2001:4488:f931::7662:5f5a;2001:448a:10a9:21c4:dc8a:ca05:995f:f94;TCP;1486;443  >  51467 [ACK] Seq=71148 Ack=828 Win=377 Len=1412 [TCP segment of a reassembled PDU];;;5,000355;5,000355;0;;0;0;0
92;5.000.355;2001:4488:f931::7662:5f5a;2001:448a:10a9:21c4:dc8a:ca05:995f:f94;TLSv1.2;1486;Application Data [TCP segment of a reassembled PDU];;;5,000355;5,000355;0;;0;0;0
93;5.000.355;2001:4488:f931::7662:5f5a;2001:448a:10a9:21c4:dc8a:ca05:995f:f94;TCP;1486;443  >  51467 [ACK] Seq=73972 Ack=828 Win=377 Len=1412 [TCP segment of a reassembled PDU];;;5,000355;5,000355;0;;-2E-05;2E-05;4E-05
94;5.000.355;2001:4488:f931::7662:5f5a;2001:448a:10a9:21c4:dc8a:ca05:995f:f94;TCP;1486;443  >  51467 [ACK] Seq=75384 Ack=828 Win=377 Len=1412 [TCP segment of a reassembled PDU];;;5,000355;5,000375;2E-05;;-1E-05;3E-05;4E-05
95;5.000.375;2001:448a:10a9:21c4:dc8a:ca05:995f:f94;2001:4488:f931::7662:5f5a;TCP;74;51467  >  443 [ACK] Seq=828 Ack=76796 Win=3088 Len=0;;;5,000375;5,000405;3E-05;;3E-05;0;-3E-05
96;5.000.405;2001:4488:f931::7662:5f5a;2001:448a:10a9:21c4:dc8a:ca05:995f:f94;TCP;1486;443  >  51467 [ACK] Seq=76796 Ack=828 Win=377 Len=1412 [TCP segment of a reassembled PDU];;;5,000405;5,000405;0;;-1,1E-05;1,1E-05;2,2E-05
97;5.000.405;2001:4488:f931::7662:5f5a;2001:448a:10a9:21c4:dc8a:ca05:995f:f94;TCP;1486;443  >  51467 [ACK] Seq=78208 Ack=828 Win=377 Len=1412 [TCP segment of a reassembled PDU];;;5,000405;5,000416;1,1E-05;;-0,000419;0,00043;0,000849
98;5.000.416;2001:448a:10a9:21c4:dc8a:ca05:995f:f94;2001:4488:f931::7662:5f5a;TCP;74;51467  >  443 [ACK] Seq=828 Ack=79620 Win=3088 Len=0;;;5,000416;5,000846;0,00043;;0,00043;0;-0,00043
99;5.000.846;2001:4488:f931::7662:5f5a;2001:448a:10a9:21c4:dc8a:ca05:995f:f94;TLSv1.2;1486;Application Data [TCP segment of a reassembled PDU];;;5,000846;5,000846;0;;0;0;0
100;5.000.846;2001:4488:f931::7662:5f5a;2001:448a:10a9:21c4:dc8a:ca05:995f:f94;TCP;1486;443  >  51467 [ACK] Seq=81032 Ack=828 Win=377 Len=1412 [TCP segment of a reassembled PDU];;;5,000846;5,000846;0;;0;0;0
101;5.000.846;2001:4488:f931::7662:5f5a;2001:448a:10a9:21c4:dc8a:ca05:995f:f94;TCP;1486;443  >  51467 [ACK] Seq=82444 Ack=828 Win=377 Len=1412 [TCP segment of a reassembled PDU];;;5,000846;5,000846;0;;-2,7E-05;2,7E-05;5,4E-05
102;5.000.846;2001:4488:f931::7662:5f5a;2001:448a:10a9:21c4:dc8a:ca05:995f:f94;TCP;1486;443  >  51467 [ACK] Seq=83856 Ack=828 Win=377 Len=1412 [TCP segment of a reassembled PDU];;;5,000846;5,000873;2,7E-05;;-0,00016;0,000187;0,000347
103;5.000.873;2001:448a:10a9:21c4:dc8a:ca05:995f:f94;2001:4488:f931::7662:5f5a;TCP;74;51467  >  443 [ACK] Seq=828 Ack=85268 Win=3088 Len=0;;;5,000873;5,00106;0,000187;;0,000187;0;-0,000187
104;5.001.060;2001:4488:f931::7662:5f5a;2001:448a:10a9:21c4:dc8a:ca05:995f:f94;TCP;1486;443  >  51467 [ACK] Seq=85268 Ack=828 Win=377 Len=1412 [TCP segment of a reassembled PDU];;;5,00106;5,00106;0;;-1,7E-05;1,7E-05;3,4E-05
105;5.001.060;2001:4488:f931::7662:5f5a;2001:448a:10a9:21c4:dc8a:ca05:995f:f94;TCP;1486;443  >  51467 [ACK] Seq=86680 Ack=828 Win=377 Len=1412 [TCP segment of a reassembled PDU];;;5,00106;5,001077;1,7E-05;;-1,1E-05;2,8E-05;3,9E-05
106;5.001.077;2001:448a:10a9:21c4:dc8a:ca05:995f:f94;2001:4488:f931::7662:5f5a;TCP;74;51467  >  443 [ACK] Seq=828 Ack=88092 Win=3088 Len=0;;;5,001077;5,001105;2,8E-05;;2,8E-05;0;-2,8E-05
107;5.001.105;2001:4488:f931::7662:5f5a;2001:448a:10a9:21c4:dc8a:ca05:995f:f94;TCP;1486;443  >  51467 [ACK] Seq=88092 Ack=828 Win=377 Len=1412 [TCP segment of a reassembled PDU];;;5,001105;5,001105;0;;-1,2E-05;1,2E-05;2,4E-05
108;5.001.105;2001:4488:f931::7662:5f5a;2001:448a:10a9:21c4:dc8a:ca05:995f:f94;TCP;1486;443  >  51467 [ACK] Seq=89504 Ack=828 Win=377 Len=1412 [TCP segment of a reassembled PDU];;;5,001105;5,001117;1,2E-05;;-0,000596;0,000608;0,001204
109;5.001.117;2001:448a:10a9:21c4:dc8a:ca05:995f:f94;2001:4488:f931::7662:5f5a;TCP;74;51467  >  443 [ACK] Seq=828 Ack=90916 Win=3088 Len=0;;;5,001117;5,001725;0,000608;;0,000608;0;-0,000608
110;5.001.725;2001:4488:f931::7662:5f5a;2001:448a:10a9:21c4:dc8a:ca05:995f:f94;TCP;1486;443  >  51467 [ACK] Seq=90916 Ack=828 Win=377 Len=1412 [TCP segment of a reassembled PDU];;;5,001725;5,001725;0;;0;0;0
111;5.001.725;2001:4488:f931::7662:5f5a;2001:448a:10a9:21c4:dc8a:ca05:995f:f94;TCP;1486;443  >  51467 [ACK] Seq=92328 Ack=828 Win=377 Len=1412 [TCP segment of a reassembled PDU];;;5,001725;5,001725;0;;0;0;0
112;5.001.725;2001:4488:f931::7662:5f5a;2001:448a:10a9:21c4:dc8a:ca05:995f:f94;TCP;1486;443  >  51467 [ACK] Seq=93740 Ack=828 Win=377 Len=1412 [TCP segment of a reassembled PDU];;;5,001725;5,001725;0;;-2,1E-05;2,1E-05;4,2E-05
113;5.001.725;2001:4488:f931::7662:5f5a;2001:448a:10a9:21c4:dc8a:ca05:995f:f94;TCP;1486;443  >  51467 [ACK] Seq=95152 Ack=828 Win=377 Len=1412 [TCP segment of a reassembled PDU];;;5,001725;5,001746;2,1E-05;;-0,000306;0,000327;0,000633
114;5.001.746;2001:448a:10a9:21c4:dc8a:ca05:995f:f94;2001:4488:f931::7662:5f5a;TCP;74;51467  >  443 [ACK] Seq=828 Ack=96564 Win=3088 Len=0;;;5,001746;5,002073;0,000327;;0,000327;0;-0,000327
115;5.002.073;2001:4488:f931::7662:5f5a;2001:448a:10a9:21c4:dc8a:ca05:995f:f94;TLSv1.2;1486;Application Data [TCP segment of a reassembled PDU];;;5,002073;5,002073;0;;0;0;0
116;5.002.073;2001:4488:f931::7662:5f5a;2001:448a:10a9:21c4:dc8a:ca05:995f:f94;TCP;1486;443  >  51467 [ACK] Seq=97976 Ack=828 Win=377 Len=1412 [TCP segment of a reassembled PDU];;;5,002073;5,002073;0;;0;0;0
117;5.002.073;2001:4488:f931::7662:5f5a;2001:448a:10a9:21c4:dc8a:ca05:995f:f94;TCP;1486;443  >  51467 [ACK] Seq=99388 Ack=828 Win=377 Len=1412 [TCP segment of a reassembled PDU];;;5,002073;5,002073;0;;-2,1E-05;2,1E-05;4,2E-05
118;5.002.073;2001:4488:f931::7662:5f5a;2001:448a:10a9:21c4:dc8a:ca05:995f:f94;TCP;1486;443  >  51467 [ACK] Seq=100800 Ack=828 Win=377 Len=1412 [TCP segment of a reassembled PDU];;;5,002073;5,002094;2,1E-05;;-9,8E-05;0,000119;0,000217
119;5.002.094;2001:448a:10a9:21c4:dc8a:ca05:995f:f94;2001:4488:f931::7662:5f5a;TCP;74;51467  >  443 [ACK] Seq=828 Ack=102212 Win=3088 Len=0;;;5,002094;5,002213;0,000119;;0,000119;0;-0,000119
120;5.002.213;2001:4488:f931::7662:5f5a;2001:448a:10a9:21c4:dc8a:ca05:995f:f94;TCP;1486;443  >  51467 [ACK] Seq=102212 Ack=828 Win=377 Len=1412 [TCP segment of a reassembled PDU];;;5,002213;5,002213;0;;-1,7E-05;1,7E-05;3,4E-05
121;5.002.213;2001:4488:f931::7662:5f5a;2001:448a:10a9:21c4:dc8a:ca05:995f:f94;TCP;1486;443  >  51467 [ACK] Seq=103624 Ack=828 Win=377 Len=1412 [TCP segment of a reassembled PDU];;;5,002213;5,00223;1,7E-05;;-0,000312;0,000329;0,000641
122;5.002.230;2001:448a:10a9:21c4:dc8a:ca05:995f:f94;2001:4488:f931::7662:5f5a;TCP;74;51467  >  443 [ACK] Seq=828 Ack=105036 Win=3088 Len=0;;;5,00223;5,002559;0,000329;;0,000329;0;-0,000329
123;5.002.559;2001:4488:f931::7662:5f5a;2001:448a:10a9:21c4:dc8a:ca05:995f:f94;TCP;1486;443  >  51467 [ACK] Seq=105036 Ack=828 Win=377 Len=1412 [TCP segment of a reassembled PDU];;;5,002559;5,002559;0;;0;0;0
124;5.002.559;2001:4488:f931::7662:5f5a;2001:448a:10a9:21c4:dc8a:ca05:995f:f94;TCP;1486;443  >  51467 [ACK] Seq=106448 Ack=828 Win=377 Len=1412 [TCP segment of a reassembled PDU];;;5,002559;5,002559;0;;0;0;0
125;5.002.559;2001:4488:f931::7662:5f5a;2001:448a:10a9:21c4:dc8a:ca05:995f:f94;TCP;1486;443  >  51467 [ACK] Seq=107860 Ack=828 Win=377 Len=1412 [TCP segment of a reassembled PDU];;;5,002559;5,002559;0;;-2,1E-05;2,1E-05;4,2E-05
126;5.002.559;2001:4488:f931::7662:5f5a;2001:448a:10a9:21c4:dc8a:ca05:995f:f94;TCP;1486;443  >  51467 [ACK] Seq=109272 Ack=828 Win=377 Len=1412 [TCP segment of a reassembled PDU];;;5,002559;5,00258;2,1E-05;;-0,000112;0,000133;0,000245
127;5.002.580;2001:448a:10a9:21c4:dc8a:ca05:995f:f94;2001:4488:f931::7662:5f5a;TCP;74;51467  >  443 [ACK] Seq=828 Ack=110684 Win=3088 Len=0;;;5,00258;5,002713;0,000133;;0,000133;0;-0,000133
128;5.002.713;2001:4488:f931::7662:5f5a;2001:448a:10a9:21c4:dc8a:ca05:995f:f94;TCP;1486;443  >  51467 [ACK] Seq=110684 Ack=828 Win=377 Len=1412 [TCP segment of a reassembled PDU];;;5,002713;5,002713;0;;-1,6E-05;1,6E-05;3,2E-05
129;5.002.713;2001:4488:f931::7662:5f5a;2001:448a:10a9:21c4:dc8a:ca05:995f:f94;TCP;1486;443  >  51467 [ACK] Seq=112096 Ack=828 Win=377 Len=1412 [TCP segment of a reassembled PDU];;;5,002713;5,002729;1,6E-05;;-0,0003;0,000316;0,000616
130;5.002.729;2001:448a:10a9:21c4:dc8a:ca05:995f:f94;2001:4488:f931::7662:5f5a;TCP;74;51467  >  443 [ACK] Seq=828 Ack=113508 Win=3088 Len=0;;;5,002729;5,003045;0,000316;;0,000316;0;-0,000316
131;5.003.045;2001:4488:f931::7662:5f5a;2001:448a:10a9:21c4:dc8a:ca05:995f:f94;TLSv1.2;1486;Application Data [TCP segment of a reassembled PDU];;;5,003045;5,003045;0;;-1,6E-05;1,6E-05;3,2E-05
132;5.003.045;2001:4488:f931::7662:5f5a;2001:448a:10a9:21c4:dc8a:ca05:995f:f94;TCP;1486;443  >  51467 [ACK] Seq=114920 Ack=828 Win=377 Len=1412 [TCP segment of a reassembled PDU];;;5,003045;5,003061;1,6E-05;;-1,6E-05;3,2E-05;4,8E-05
133;5.003.061;2001:448a:10a9:21c4:dc8a:ca05:995f:f94;2001:4488:f931::7662:5f5a;TCP;74;51467  >  443 [ACK] Seq=828 Ack=116332 Win=3088 Len=0;;;5,003061;5,003093;3,2E-05;;3,2E-05;0;-3,2E-05
134;5.003.093;2001:4488:f931::7662:5f5a;2001:448a:10a9:21c4:dc8a:ca05:995f:f94;TCP;1486;443  >  51467 [ACK] Seq=116332 Ack=828 Win=377 Len=1412 [TCP segment of a reassembled PDU];;;5,003093;5,003093;0;;-9E-06;9E-06;1,8E-05
135;5.003.093;2001:4488:f931::7662:5f5a;2001:448a:10a9:21c4:dc8a:ca05:995f:f94;TCP;1486;443  >  51467 [ACK] Seq=117744 Ack=828 Win=377 Len=1412 [TCP segment of a reassembled PDU];;;5,003093;5,003102;9E-06;;-0,000951;0,00096;0,001911
136;5.003.102;2001:448a:10a9:21c4:dc8a:ca05:995f:f94;2001:4488:f931::7662:5f5a;TCP;74;51467  >  443 [ACK] Seq=828 Ack=119156 Win=3088 Len=0;;;5,003102;5,004062;0,00096;;0,00096;0;-0,00096
137;5.004.062;2001:4488:f931::7662:5f5a;2001:448a:10a9:21c4:dc8a:ca05:995f:f94;TCP;1486;443  >  51467 [ACK] Seq=119156 Ack=828 Win=377 Len=1412 [TCP segment of a reassembled PDU];;;5,004062;5,004062;0;;-1,6E-05;1,6E-05;3,2E-05
138;5.004.062;2001:4488:f931::7662:5f5a;2001:448a:10a9:21c4:dc8a:ca05:995f:f94;TLSv1.2;1486;Application Data [TCP segment of a reassembled PDU];;;5,004062;5,004078;1,6E-05;;-1,6E-05;3,2E-05;4,8E-05
139;5.004.078;2001:448a:10a9:21c4:dc8a:ca05:995f:f94;2001:4488:f931::7662:5f5a;TCP;74;51467  >  443 [ACK] Seq=828 Ack=121980 Win=3088 Len=0;;;5,004078;5,00411;3,2E-05;;3,2E-05;0;-3,2E-05
140;5.004.110;2001:4488:f931::7662:5f5a;2001:448a:10a9:21c4:dc8a:ca05:995f:f94;TCP;1486;443  >  51467 [ACK] Seq=121980 Ack=828 Win=377 Len=1412 [TCP segment of a reassembled PDU];;;5,00411;5,00411;0;;0;0;0
141;5.004.110;2001:4488:f931::7662:5f5a;2001:448a:10a9:21c4:dc8a:ca05:995f:f94;TCP;1486;443  >  51467 [ACK] Seq=123392 Ack=828 Win=377 Len=1412 [TCP segment of a reassembled PDU];;;5,00411;5,00411;0;;0;0;0
142;5.004.110;2001:4488:f931::7662:5f5a;2001:448a:10a9:21c4:dc8a:ca05:995f:f94;TCP;1486;443  >  51467 [ACK] Seq=124804 Ack=828 Win=377 Len=1412 [TCP segment of a reassembled PDU];;;5,00411;5,00411;0;;-1,6E-05;1,6E-05;3,2E-05
143;5.004.110;2001:4488:f931::7662:5f5a;2001:448a:10a9:21c4:dc8a:ca05:995f:f94;TCP;1486;443  >  51467 [ACK] Seq=126216 Ack=828 Win=377 Len=1412 [TCP segment of a reassembled PDU];;;5,00411;5,004126;1,6E-05;;-0,000461;0,000477;0,000938
144;5.004.126;2001:448a:10a9:21c4:dc8a:ca05:995f:f94;2001:4488:f931::7662:5f5a;TCP;74;51467  >  443 [ACK] Seq=828 Ack=127628 Win=3088 Len=0;;;5,004126;5,004603;0,000477;;0,000477;0;-0,000477
145;5.004.603;2001:4488:f931::7662:5f5a;2001:448a:10a9:21c4:dc8a:ca05:995f:f94;TCP;1486;443  >  51467 [ACK] Seq=127628 Ack=828 Win=377 Len=1412 [TCP segment of a reassembled PDU];;;5,004603;5,004603;0;;0;0;0
146;5.004.603;2001:4488:f931::7662:5f5a;2001:448a:10a9:21c4:dc8a:ca05:995f:f94;TCP;1486;443  >  51467 [ACK] Seq=129040 Ack=828 Win=377 Len=1412 [TCP segment of a reassembled PDU];;;5,004603;5,004603;0;;0;0;0
147;5.004.603;2001:4488:f931::7662:5f5a;2001:448a:10a9:21c4:dc8a:ca05:995f:f94;TCP;1486;443  >  51467 [ACK] Seq=130452 Ack=828 Win=377 Len=1412 [TCP segment of a reassembled PDU];;;5,004603;5,004603;0;;0;0;0
148;5.004.603;2001:4488:f931::7662:5f5a;2001:448a:10a9:21c4:dc8a:ca05:995f:f94;TCP;1486;443  >  51467 [ACK] Seq=131864 Ack=828 Win=377 Len=1412 [TCP segment of a reassembled PDU];;;5,004603;5,004603;0;;0;0;0
149;5.004.603;2001:4488:f931::7662:5f5a;2001:448a:10a9:21c4:dc8a:ca05:995f:f94;TLSv1.2;1486;Application Data [TCP segment of a reassembled PDU];;;5,004603;5,004603;0;;-3,8E-05;3,8E-05;7,6E-05
150;5.004.603;2001:4488:f931::7662:5f5a;2001:448a:10a9:21c4:dc8a:ca05:995f:f94;TCP;1486;443  >  51467 [ACK] Seq=134688 Ack=828 Win=377 Len=1412 [TCP segment of a reassembled PDU];;;5,004603;5,004641;3,8E-05;;-0,000279;0,000317;0,000596
151;5.004.641;2001:448a:10a9:21c4:dc8a:ca05:995f:f94;2001:4488:f931::7662:5f5a;TCP;74;51467  >  443 [ACK] Seq=828 Ack=136100 Win=3088 Len=0;;;5,004641;5,004958;0,000317;;0,000317;0;-0,000317
152;5.004.958;2001:4488:f931::7662:5f5a;2001:448a:10a9:21c4:dc8a:ca05:995f:f94;TCP;1486;443  >  51467 [ACK] Seq=136100 Ack=828 Win=377 Len=1412 [TCP segment of a reassembled PDU];;;5,004958;5,004958;0;;-1,8E-05;1,8E-05;3,6E-05
153;5.004.958;2001:4488:f931::7662:5f5a;2001:448a:10a9:21c4:dc8a:ca05:995f:f94;TCP;1486;443  >  51467 [ACK] Seq=137512 Ack=828 Win=377 Len=1412 [TCP segment of a reassembled PDU];;;5,004958;5,004976;1,8E-05;;-1,2E-05;3E-05;4,2E-05
154;5.004.976;2001:448a:10a9:21c4:dc8a:ca05:995f:f94;2001:4488:f931::7662:5f5a;TCP;74;51467  >  443 [ACK] Seq=828 Ack=138924 Win=3088 Len=0;;;5,004976;5,005006;3E-05;;3E-05;0;-3E-05
155;5.005.006;2001:4488:f931::7662:5f5a;2001:448a:10a9:21c4:dc8a:ca05:995f:f94;TCP;1486;443  >  51467 [ACK] Seq=138924 Ack=828 Win=377 Len=1412 [TCP segment of a reassembled PDU];;;5,005006;5,005006;0;;-9E-06;9E-06;1,8E-05
156;5.005.006;2001:4488:f931::7662:5f5a;2001:448a:10a9:21c4:dc8a:ca05:995f:f94;TCP;1486;443  >  51467 [ACK] Seq=140336 Ack=828 Win=377 Len=1412 [TCP segment of a reassembled PDU];;;5,005006;5,005015;9E-06;;-0,00038;0,000389;0,000769
157;5.005.015;2001:448a:10a9:21c4:dc8a:ca05:995f:f94;2001:4488:f931::7662:5f5a;TCP;74;51467  >  443 [ACK] Seq=828 Ack=141748 Win=3088 Len=0;;;5,005015;5,005404;0,000389;;0,000389;0;-0,000389
158;5.005.404;2001:4488:f931::7662:5f5a;2001:448a:10a9:21c4:dc8a:ca05:995f:f94;TCP;1486;443  >  51467 [ACK] Seq=141748 Ack=828 Win=377 Len=1412 [TCP segment of a reassembled PDU];;;5,005404;5,005404;0;;-1,6E-05;1,6E-05;3,2E-05
159;5.005.404;2001:4488:f931::7662:5f5a;2001:448a:10a9:21c4:dc8a:ca05:995f:f94;TCP;1486;443  >  51467 [ACK] Seq=143160 Ack=828 Win=377 Len=1412 [TCP segment of a reassembled PDU];;;5,005404;5,00542;1,6E-05;;-2,1E-05;3,7E-05;5,8E-05
160;5.005.420;2001:448a:10a9:21c4:dc8a:ca05:995f:f94;2001:4488:f931::7662:5f5a;TCP;74;51467  >  443 [ACK] Seq=828 Ack=144572 Win=3088 Len=0;;;5,00542;5,005457;3,7E-05;;3,7E-05;0;-3,7E-05
161;5.005.457;2001:4488:f931::7662:5f5a;2001:448a:10a9:21c4:dc8a:ca05:995f:f94;TCP;1486;443  >  51467 [ACK] Seq=144572 Ack=828 Win=377 Len=1412 [TCP segment of a reassembled PDU];;;5,005457;5,005457;0;;-1,3E-05;1,3E-05;2,6E-05
162;5.005.457;2001:4488:f931::7662:5f5a;2001:448a:10a9:21c4:dc8a:ca05:995f:f94;TCP;1486;443  >  51467 [ACK] Seq=145984 Ack=828 Win=377 Len=1412 [TCP segment of a reassembled PDU];;;5,005457;5,00547;1,3E-05;;-0,000726;0,000739;0,001465
163;5.005.470;2001:448a:10a9:21c4:dc8a:ca05:995f:f94;2001:4488:f931::7662:5f5a;TCP;74;51467  >  443 [ACK] Seq=828 Ack=147396 Win=3088 Len=0;;;5,00547;5,006209;0,000739;;0,000739;0;-0,000739
164;5.006.209;2001:4488:f931::7662:5f5a;2001:448a:10a9:21c4:dc8a:ca05:995f:f94;TCP;1486;443  >  51467 [ACK] Seq=147396 Ack=828 Win=377 Len=1412 [TCP segment of a reassembled PDU];;;5,006209;5,006209;0;;-1,8E-05;1,8E-05;3,6E-05
165;5.006.209;2001:4488:f931::7662:5f5a;2001:448a:10a9:21c4:dc8a:ca05:995f:f94;TCP;1486;443  >  51467 [ACK] Seq=148808 Ack=828 Win=377 Len=1412 [TCP segment of a reassembled PDU];;;5,006209;5,006227;1,8E-05;;-1E-05;2,8E-05;3,8E-05
166;5.006.227;2001:448a:10a9:21c4:dc8a:ca05:995f:f94;2001:4488:f931::7662:5f5a;TCP;74;51467  >  443 [ACK] Seq=828 Ack=150220 Win=3088 Len=0;;;5,006227;5,006255;2,8E-05;;2,8E-05;0;-2,8E-05
167;5.006.255;2001:4488:f931::7662:5f5a;2001:448a:10a9:21c4:dc8a:ca05:995f:f94;TLSv1.2;1486;Application Data [TCP segment of a reassembled PDU];;;5,006255;5,006255;0;;-1,3E-05;1,3E-05;2,6E-05
168;5.006.255;2001:4488:f931::7662:5f5a;2001:448a:10a9:21c4:dc8a:ca05:995f:f94;TCP;1486;443  >  51467 [ACK] Seq=151632 Ack=828 Win=377 Len=1412 [TCP segment of a reassembled PDU];;;5,006255;5,006268;1,3E-05;;-8E-06;2,1E-05;2,9E-05
169;5.006.268;2001:448a:10a9:21c4:dc8a:ca05:995f:f94;2001:4488:f931::7662:5f5a;TCP;74;51467  >  443 [ACK] Seq=828 Ack=153044 Win=3088 Len=0;;;5,006268;5,006289;2,1E-05;;2,1E-05;0;-2,1E-05
170;5.006.289;2001:4488:f931::7662:5f5a;2001:448a:10a9:21c4:dc8a:ca05:995f:f94;TCP;1486;443  >  51467 [ACK] Seq=153044 Ack=828 Win=377 Len=1412 [TCP segment of a reassembled PDU];;;5,006289;5,006289;0;;-1E-05;1E-05;2E-05
171;5.006.289;2001:4488:f931::7662:5f5a;2001:448a:10a9:21c4:dc8a:ca05:995f:f94;TCP;1486;443  >  51467 [ACK] Seq=154456 Ack=828 Win=377 Len=1412 [TCP segment of a reassembled PDU];;;5,006289;5,006299;1E-05;;-0,000418;0,000428;0,000846
172;5.006.299;2001:448a:10a9:21c4:dc8a:ca05:995f:f94;2001:4488:f931::7662:5f5a;TCP;74;51467  >  443 [ACK] Seq=828 Ack=155868 Win=3088 Len=0;;;5,006299;5,006727;0,000428;;0,000428;0;-0,000428
173;5.006.727;2001:4488:f931::7662:5f5a;2001:448a:10a9:21c4:dc8a:ca05:995f:f94;TCP;1486;443  >  51467 [ACK] Seq=155868 Ack=828 Win=377 Len=1412 [TCP segment of a reassembled PDU];;;5,006727;5,006727;0;;0;0;0
174;5.006.727;2001:4488:f931::7662:5f5a;2001:448a:10a9:21c4:dc8a:ca05:995f:f94;TCP;1486;443  >  51467 [ACK] Seq=157280 Ack=828 Win=377 Len=1412 [TCP segment of a reassembled PDU];;;5,006727;5,006727;0;;0;0;0
175;5.006.727;2001:4488:f931::7662:5f5a;2001:448a:10a9:21c4:dc8a:ca05:995f:f94;TCP;1486;443  >  51467 [ACK] Seq=158692 Ack=828 Win=377 Len=1412 [TCP segment of a reassembled PDU];;;5,006727;5,006727;0;;-2,6E-05;2,6E-05;5,2E-05
176;5.006.727;2001:4488:f931::7662:5f5a;2001:448a:10a9:21c4:dc8a:ca05:995f:f94;TCP;1486;443  >  51467 [ACK] Seq=160104 Ack=828 Win=377 Len=1412 [TCP segment of a reassembled PDU];;;5,006727;5,006753;2,6E-05;;-3E-06;2,9E-05;3,2E-05
177;5.006.753;2001:448a:10a9:21c4:dc8a:ca05:995f:f94;2001:4488:f931::7662:5f5a;TCP;74;51467  >  443 [ACK] Seq=828 Ack=161516 Win=3088 Len=0;;;5,006753;5,006782;2,9E-05;;2,9E-05;0;-2,9E-05
178;5.006.782;2001:4488:f931::7662:5f5a;2001:448a:10a9:21c4:dc8a:ca05:995f:f94;TCP;1486;443  >  51467 [ACK] Seq=161516 Ack=828 Win=377 Len=1412 [TCP segment of a reassembled PDU];;;5,006782;5,006782;0;;-1,1E-05;1,1E-05;2,2E-05
179;5.006.782;2001:4488:f931::7662:5f5a;2001:448a:10a9:21c4:dc8a:ca05:995f:f94;TCP;1486;443  >  51467 [ACK] Seq=162928 Ack=828 Win=377 Len=1412 [TCP segment of a reassembled PDU];;;5,006782;5,006793;1,1E-05;;-0,002917;0,002928;0,005845
180;5.006.793;2001:448a:10a9:21c4:dc8a:ca05:995f:f94;2001:4488:f931::7662:5f5a;TCP;74;51467  >  443 [ACK] Seq=828 Ack=164340 Win=3088 Len=0;;;5,006793;5,009721;0,002928;;0,002928;0;-0,002928
181;5.009.721;2001:4488:f931::7662:5f5a;2001:448a:10a9:21c4:dc8a:ca05:995f:f94;TCP;1486;443  >  51467 [ACK] Seq=164340 Ack=828 Win=377 Len=1412 [TCP segment of a reassembled PDU];;;5,009721;5,009721;0;;-4,2E-05;4,2E-05;8,4E-05
182;5.009.721;2001:4488:f931::7662:5f5a;2001:448a:10a9:21c4:dc8a:ca05:995f:f94;TLSv1.2;248;Application Data;;;5,009721;5,009763;4,2E-05;;-2,495804;2,495846;4,99165
183;5.009.763;2001:448a:10a9:21c4:dc8a:ca05:995f:f94;2001:4488:f931::7662:5f5a;TCP;74;51467  >  443 [ACK] Seq=828 Ack=165926 Win=3088 Len=0;;;5,009763;7,505609;2,495846;;-1,478136;3,973982;5,452118
197;7.505.609;2001:448a:10a9:21c4:dc8a:ca05:995f:f94;64:ff9b::8c52:7115;TCP;75;51472  >  443 [ACK] Seq=1 Ack=1 Win=508 Len=1 [TCP segment of a reassembled PDU];;;7,505609;11,479591;3,973982;;3,973932;5E-05;-3,973882
214;11.479.591;64:ff9b::23d4:70c0;2001:448a:10a9:21c4:dc8a:ca05:995f:f94;TCP;74;443  >  51498 [ACK] Seq=1 Ack=1 Win=501 Len=0;;;11,479591;11,479641;5E-05;;-2,627018;2,627068;5,254086
215;11.479.641;2001:448a:10a9:21c4:dc8a:ca05:995f:f94;64:ff9b::23d4:70c0;TCP;74;[TCP ACKed unseen segment] 51498  >  443 [ACK] Seq=1 Ack=2 Win=512 Len=0;;;11,479641;14,106709;2,627068;;1,700651;0,926417;-0,774234
234;14.106.709;180.76.107.5;192.168.100.34;TCP;54;52524  >  4243 [SYN] Seq=0 Win=1024 Len=0;;;14,106709;15,033126;0,926417;;0,907343;0,019074;-0,888269
651;15.033.126;2001:448a:10a9:21c4:dc8a:ca05:995f:f94;2001:4488:f931::7662:5f5a;TLSv1.2;901;Application Data;;;15,033126;15,0522;0,019074;;0,019074;0;-0,019074
652;15.052.200;2001:4488:f931::7662:5f5a;2001:448a:10a9:21c4:dc8a:ca05:995f:f94;TLSv1.2;662;Application Data;;;15,0522;15,0522;0;;0;0;0
653;15.052.200;2001:4488:f931::7662:5f5a;2001:448a:10a9:21c4:dc8a:ca05:995f:f94;TCP;1486;443  >  51467 [ACK] Seq=166514 Ack=1655 Win=389 Len=1412 [TCP segment of a reassembled PDU];;;15,0522;15,0522;0;;-4,2E-05;4,2E-05;8,4E-05
654;15.052.200;2001:4488:f931::7662:5f5a;2001:448a:10a9:21c4:dc8a:ca05:995f:f94;TCP;1486;443  >  51467 [ACK] Seq=167926 Ack=1655 Win=389 Len=1412 [TCP segment of a reassembled PDU];;;15,0522;15,052242;4,2E-05;;-0,000261;0,000303;0,000564
655;15.052.242;2001:448a:10a9:21c4:dc8a:ca05:995f:f94;2001:4488:f931::7662:5f5a;TCP;74;51467  >  443 [ACK] Seq=1655 Ack=169338 Win=3088 Len=0;;;15,052242;15,052545;0,000303;;0,000303;0;-0,000303
656;15.052.545;2001:4488:f931::7662:5f5a;2001:448a:10a9:21c4:dc8a:ca05:995f:f94;TCP;1486;443  >  51467 [ACK] Seq=169338 Ack=1655 Win=389 Len=1412 [TCP segment of a reassembled PDU];;;15,052545;15,052545;0;;-3,6E-05;3,6E-05;7,2E-05
657;15.052.545;2001:4488:f931::7662:5f5a;2001:448a:10a9:21c4:dc8a:ca05:995f:f94;TCP;1486;443  >  51467 [ACK] Seq=170750 Ack=1655 Win=389 Len=1412 [TCP segment of a reassembled PDU];;;15,052545;15,052581;3,6E-05;;-7,5E-05;0,000111;0,000186
658;15.052.581;2001:448a:10a9:21c4:dc8a:ca05:995f:f94;2001:4488:f931::7662:5f5a;TCP;74;51467  >  443 [ACK] Seq=1655 Ack=172162 Win=3088 Len=0;;;15,052581;15,052692;0,000111;;0,000111;0;-0,000111
659;15.052.692;2001:4488:f931::7662:5f5a;2001:448a:10a9:21c4:dc8a:ca05:995f:f94;TCP;1486;443  >  51467 [ACK] Seq=172162 Ack=1655 Win=389 Len=1412 [TCP segment of a reassembled PDU];;;15,052692;15,052692;0;;-1,6E-05;1,6E-05;3,2E-05
660;15.052.692;2001:4488:f931::7662:5f5a;2001:448a:10a9:21c4:dc8a:ca05:995f:f94;TCP;1486;443  >  51467 [ACK] Seq=173574 Ack=1655 Win=389 Len=1412 [TCP segment of a reassembled PDU];;;15,052692;15,052708;1,6E-05;;-0,000214;0,00023;0,000444
661;15.052.708;2001:448a:10a9:21c4:dc8a:ca05:995f:f94;2001:4488:f931::7662:5f5a;TCP;74;51467  >  443 [ACK] Seq=1655 Ack=174986 Win=3088 Len=0;;;15,052708;15,052938;0,00023;;0,00023;0;-0,00023
662;15.052.938;2001:4488:f931::7662:5f5a;2001:448a:10a9:21c4:dc8a:ca05:995f:f94;TCP;1486;443  >  51467 [ACK] Seq=174986 Ack=1655 Win=389 Len=1412 [TCP segment of a reassembled PDU];;;15,052938;15,052938;0;;-3E-05;3E-05;6E-05
663;15.052.938;2001:4488:f931::7662:5f5a;2001:448a:10a9:21c4:dc8a:ca05:995f:f94;TCP;1486;443  >  51467 [ACK] Seq=176398 Ack=1655 Win=389 Len=1412 [TCP segment of a reassembled PDU];;;15,052938;15,052968;3E-05;;-2,6E-05;5,6E-05;8,2E-05
664;15.052.968;2001:448a:10a9:21c4:dc8a:ca05:995f:f94;2001:4488:f931::7662:5f5a;TCP;74;51467  >  443 [ACK] Seq=1655 Ack=177810 Win=3088 Len=0;;;15,052968;15,053024;5,6E-05;;5,6E-05;0;-5,6E-05
665;15.053.024;2001:4488:f931::7662:5f5a;2001:448a:10a9:21c4:dc8a:ca05:995f:f94;TCP;1486;443  >  51467 [ACK] Seq=177810 Ack=1655 Win=389 Len=1412 [TCP segment of a reassembled PDU];;;15,053024;15,053024;0;;-1,9E-05;1,9E-05;3,8E-05
666;15.053.024;2001:4488:f931::7662:5f5a;2001:448a:10a9:21c4:dc8a:ca05:995f:f94;TCP;1486;443  >  51467 [ACK] Seq=179222 Ack=1655 Win=389 Len=1412 [TCP segment of a reassembled PDU];;;15,053024;15,053043;1,9E-05;;-0,00014;0,000159;0,000299
667;15.053.043;2001:448a:10a9:21c4:dc8a:ca05:995f:f94;2001:4488:f931::7662:5f5a;TCP;74;51467  >  443 [ACK] Seq=1655 Ack=180634 Win=3088 Len=0;;;15,053043;15,053202;0,000159;;0,000159;0;-0,000159
668;15.053.202;2001:4488:f931::7662:5f5a;2001:448a:10a9:21c4:dc8a:ca05:995f:f94;TCP;1486;443  >  51467 [ACK] Seq=180634 Ack=1655 Win=389 Len=1412 [TCP segment of a reassembled PDU];;;15,053202;15,053202;0;;-1,5E-05;1,5E-05;3E-05
669;15.053.202;2001:4488:f931::7662:5f5a;2001:448a:10a9:21c4:dc8a:ca05:995f:f94;TLSv1.2;955;Application Data;;;15,053202;15,053217;1,5E-05;;-0,000119;0,000134;0,000253
670;15.053.217;2001:448a:10a9:21c4:dc8a:ca05:995f:f94;2001:4488:f931::7662:5f5a;TCP;74;51467  >  443 [ACK] Seq=1655 Ack=182927 Win=3088 Len=0;;;15,053217;15,053351;0,000134;;0,000134;0;-0,000134
671;15.053.351;2001:4488:f931::7662:5f5a;2001:448a:10a9:21c4:dc8a:ca05:995f:f94;TCP;1486;443  >  51467 [ACK] Seq=182927 Ack=1655 Win=389 Len=1412 [TCP segment of a reassembled PDU];;;15,053351;15,053351;0;;-1,5E-05;1,5E-05;3E-05
